,0,1,2
16,"Downtown Los Angeles has had more than 15 inches of rain since Jan. 1, more than its average rainfall for an entire year, including 2.6 inches on Sunday, a record, the National Weather Service said.","Los Angeles will get a much-needed break early Monday from the unforgiving rain that has pounded Southern California since Thursday, but a new front will move in Monday night, bringing with it an additional 2 inches to 4 inches of rain.",0.915276050567627
35,"Chess genius Bobby Fischer, now in a Japanese detention cell awaiting deportation to the United States, will be allowed to leave Japan for Iceland if that country grants him citizenship, an opposition party leader said Wednesday.","Fischer became world chess champion in a 1972 match in Iceland against the Soviet Union's Boris Spassky, and some of his Icelandic supporters have campaigned to help him out of gratitude for putting Iceland in the global spotlight.",0.9141326546669006
55,"Jeff Lungren, a spokesman for the House Judiciary Committee, which spearheaded the REAL ID Act, said that the states that will be most affected are the ones doing poorly in verifying identification documents, including nine ""problem"" states--Wisconsin, Oregon, Maryland, Michigan, New Mexico, North Carolina, Washington, Hawaii and Montana.","Tim Sparapani, ACLU legislative counsel, said the Real ID Act's rules would result in a de facto national identification card because it would require states to pool driver data in a national database.",0.9136954545974731
28,"Speaking to reporters earlier Monday, Blair repeated his call  for republicans to unequivocally give up violence and commit  themselves to wholly democratic methods.","Northern Ireland's peace process would  receive a major boost if the Irish Republican Army responds  positively to appeals to embrace political methods, a leading figure  in the paramilitary group's political wing said Friday.",0.9131789803504944
1,"The prime minister will be in (the Indian Kashmir summer  capital) Srinagar to flag off the first bus on April 7,"" Singh's  spokesman said.","Singh _ on his first visit as prime minister to India's Jammu-Kashmir state _ also announced a four-year, multibillion-dollar development plan he promised would result in thousands of jobs for people in the region.",0.9123356938362122
57,"Whether the decision to recall the product ends up undermining Merck's legal defenses or improving its image to juries is less predictable, according to legal experts.","Some lawyers, including those who had filed suits against Merck before the Vioxx withdrawal, said that they already had plenty of evidence of the drug's dangers before last week's announcement.",0.9120193719863892
31,"A total of 10 Sri Lanka's Tamil Tiger rebels were released on bail on Thursday in the eastern Batticaloa district, the pro-rebel Tamilnet said.","Hagrup Haukland, deputy chief of the Sri Lanka Monitoring Mission overseeing the ongoing ceasefire between the government and the Liberation Tigers of Tamil Eelam (LTTE) rebels, said that the rebels had convey this message to them after consultation with their political wing leader S.P. Thamilselvan currently on a European tour.",0.9119223356246948
27,"Speaking to reporters earlier Monday, Blair repeated his call  for republicans to unequivocally give up violence and commit  themselves to wholly democratic methods.","Ahern that the key to moving forward was for the Irish Republican  Army (IRA), Northern Ireland's main Catholic paramilitary group, to  end all violence unequivocally.",0.9116983413696289
12,"Local and federal law enforcement officials said on Tuesday that they were investigating possible connections between the double murder and Matthew Hale, the white supremacist currently in federal prison for soliciting Lefkow's assassination, or his many sympathizers.","A crowd protesting a white supremacists' march turned violent, throwing baseball-sized rocks at police, vandalizing vehicles and stores, and setting fire to a neighborhood bar, authorities said.",0.9108622074127197
86,"Simon Peh, assistant director of Immigration Department, said  as one thirds of the Hong Kong Disneyland visitors are expected to come from the Chinese mainland, the Immigration Department is  ready to dispatch more staff members to various cross-border check points during the opening day and other holidays.","Specially invited guests including business affiliates, travel  trade associates, contractors, consultants, alliance partners,  government officers who have been involved in the Hong Kong  Disneyland project, and certain charitable organizations can enjoy a full day of Disney magic.",0.9107722640037537
88,"The European-made space probe Huygens headed Saturday for a historic up-close encounter with Titan, the only celestial body of the Solar system with an atmosphere resembling that of Earth, after successfully separating from the US spacecraft Cassini.","From what scientists can tell, the chemical composition of Titan's atmosphere reflects what was on Earth several billion years ago, when life was just getting started, said Carolyn Porco, Cassini imaging leader and a researcher with the Space Science Institute in Boulder,",0.9098190069198608
20,"Union Pacific's troubles included 23 mudslides that covered tracks in the Cajon Pass east of Los Angeles, a key passageway from Southern California to Las Vegas and Salt Lake City, and eventually to the Midwest.","As stormy weather continued to pound Southern California on Saturday, about 170 people were freed from cars near Big Bear where they had been trapped for up to 15 hours in deep snow, several of the state's major arteries were closed and rescue workers pulled two people from raging streams.",0.9083129167556763
60,"Some lawyers, including those who had filed suits against Merck before the Vioxx withdrawal, said that they already had plenty of evidence of the drug's dangers before last week's announcement.","Although the U.S. Food and Drug Administration said the risk of an individual patient having a heart attack or stroke related to Vioxx is small, the agency also said ""there appear to be significant safety concerns.",0.9071921706199646
49,"Ask Loeffler and his bandmates/siblings Sam and Pete to list the music that influenced the band's sound, and they'll list Helmet, Tool, Sinead O'Connor and Yusuf Islam -- the artist once known as Cat Stevens and most recently in the news as being on the United State's no-fly list for alleged ties to terrorism, an accusation the artist vehemently denies.","The ""Man for Peace"" award was being given to Islam ""for his dedication to promote peace, the reconciliation of people and to condemn terrorism,"" said a press release by the Gorbachev Foundation and Rome's City Hall.",0.9065455794334412
34,"Chess legend Bobby Fischer, who faces  prison if he returns to the United States, can only avoid  deportation from Japan if Iceland upgrades its granting of residency  to full citizenship, a Japanese lawmaker said Wednesday.","Fischer became world chess champion in a 1972 match in Iceland against the Soviet Union's Boris Spassky, and some of his Icelandic supporters have campaigned to help him out of gratitude for putting Iceland in the global spotlight.",0.9059924483299255
83,"A southbound commuter train heading to downtown Los Angeles hit the Jeep Grand Cherokee parked on the tracks, said Glendale Police Chief Randy G. Adams.","At least 10 people were killed and more than 180 injured Wednesday when a commuter train derailed after crashing into a car parked on tracks north of Los Angeles, then sideswiped an oncoming train, knocking it off its rails.",0.9058842062950134
23,"But while working for the Department of Justice after the Sept. 11 terrorist attacks, Yoo helped write a series of legal memos redefining torture and advising President Bush that the Geneva Convention does not apply to members of al-Qaida and the Taliban.","The 15-page document, dated September 25, 2001, was written by conservative Justice Department lawyer John Yoo and addressed to White House counsel Alberto Gonzales.",0.9057651162147522
65,"The allegations of the Tyco case -- including news of lavish parties and a $6,000 shower curtain -- revolve around whether corporate executives had the permission of the company's board before embarking on ""extraordinary conspicuous consumption,"" he said.",Former top executives L. Dennis Kozlowski and Mark Swartz are awaiting retrial in federal court in New York on charges of stealing $600 million (euro483.33 million) from the company.,0.9053664207458496
11,"Local and federal law enforcement officials said on Tuesday that they were investigating possible connections between the double murder and Matthew Hale, the white supremacist currently in federal prison for soliciting Lefkow's assassination, or his many sympathizers.",The violence broke out after a group of nearly 80 white  supremacists of the Virigina-based National Socialist Movement  assembled for a march against what they called black gang violence  against whites in the Toledo neighborhood.,0.9050735235214233
63,"ABC News anchor Peter Jennings has been diagnosed with lung cancer, the network announced Tuesday, and will immediately begin a round of outpatient chemotherapy that is expected to keep him from the anchor desk at times in the coming months.","After a four-month period in which Tom Brokaw retired at NBC, Dan Rather relinquished the anchor chair at CBS and Ted Koppel said he was leaving ABC,",0.9050681591033936
38,Justice Stephen G. Breyer said he had reluctantly and tentatively come to the conclusion that there was no way for the court to decide religious display cases other than by evaluating the divisive nature of the display on a case-by-case basis.,The Supreme Court decided to hear the Texas and Kentucky cases amid a national debate on religion's role in government.,0.9044667482376099
30,"The Tamil Tigers were reportedly undertaking a three-week tour of Denmark, Ireland, Switzerland and Sri Lanka's peace broker Norway to persuade donors to use aid as a tool to pressure the government to resume peace talks based on rebel self-rule proposals.",The release of the two homeguards comes after a group of 10 LTTE rebels charged under the Offensive Weapons Ordnance were set free on bail on Thursday in the eastern Batticaloa district under a court order.,0.9034548401832581
3,"Peru's health minister said Monday that government plans to distribute morning-after birth control pills at public health clinics will begin as scheduled in January, despite an attempt by conservative lawmakers in this predominantly Roman Catholic country to have her prosecuted for promoting abortion.","In March, a CVS pharmacist in North Richland Hills refused to fill Julee Lacey's prescription for birth control pills.",0.9031146168708801
75,"In an editorial last year in the journal Neurology, Sirven said the best studies of marijuana's effects on humans so far have shown little objective evidence of benefit in patients with epilepsy or multiple sclerosis.","The study, he said, ruled out the possibility that the teenagers who used marijuana were also those who were more likely to develop schizophrenia, whether or not they used the drug.",0.9026722311973572
13,"But on Monday night, federal marshals met Laura Lefkow's plane from Los Angeles, and they stood guard on Tuesday as the family planned Saturday funerals for Michael F. Lefkow, 64, an attorney who was a leader in the Episcopal church, and Donna Humphrey, 89, an ailing grandmother who hand-stitched quilts for each of her 23 descendants.",The violence broke out after a group of nearly 80 white  supremacists of the Virigina-based National Socialist Movement  assembled for a march against what they called black gang violence  against whites in the Toledo neighborhood.,0.9026656150817871
19,"Los Angeles will get a much-needed break early Monday from the unforgiving rain that has pounded Southern California since Thursday, but a new front will move in Monday night, bringing with it an additional 2 inches to 4 inches of rain.","As stormy weather continued to pound Southern California on Saturday, about 170 people were freed from cars near Big Bear where they had been trapped for up to 15 hours in deep snow, several of the state's major arteries were closed and rescue workers pulled two people from raging streams.",0.8966346383094788
97,"Two fiery speeches delivered to Sikh groups in the early 1980s show Ajaib Singh Bagri had a motive to plant bombs on Air India jets killing 331 people, a prosecutor said in closing arguments Monday.","Malik and Bagri, who have been in custody since their arrest in late 2000, are also charged in connection with a blast on the same day that killed two baggage handlers at Tokyo's Narita Airport.",0.8957520723342896
80,"Whittington -- a prominent Austin attorney -- and the vice president arrived for a weekend hunting trip Friday night at the 50,000-acre Armstrong ranch, a well-known retreat for wealthy Texas Republicans 95 miles south of Corpus Christi.","Sunday afternoon -- Cheney visits Whittington at the Corpus Christi hospital before returning to Washington, D.C. 3:30 p.m. EST -- News organizations confirm the Corpus Christi Caller-Times account with vice president's office at the White House.",0.8928595185279846
7,"With well-developed wafer and semiconductor industries, Taiwan has great promise in solar energy development, the chief executive officer of Taiwan's leading crystalline silicon solar cell manufacturing company said Monday.","Given increasing electric rates, decreasing costs of solar panels and economic incentives available to homeowners through tax credits and rebates, Stout expects installations of solar power systems to increase rapidly in the next few years.",0.8924961090087891
8,"Given increasing electric rates, decreasing costs of solar panels and economic incentives available to homeowners through tax credits and rebates, Stout expects installations of solar power systems to increase rapidly in the next few years.",Yet these dire developments have been a boon for companies that make devices like silicon wafers and rooftop panels that convert solar energy.,0.8914743661880493
76,"The study, he said, ruled out the possibility that the teenagers who used marijuana were also those who were more likely to develop schizophrenia, whether or not they used the drug.","The evidence for the second process, he said, is that twins who reported that they had lived apart the longest also had the greatest differences in their epigenome.",0.8886367082595825
53,"President George W. Bush on Monday urged Congress to reauthorize the USA Patriot Act, the Justice Department's widely criticized anti-terrorism law.","The coalition wants Congress to repeal or let expire prosecutors' Patriot Act ability to easily obtain records in terrorism-related cases from businesses and other entities, including libraries; the provision that allows ""sneak and peek"" searches conducted without a property owner's or resident's knowledge and with warrants delivered afterward; and what they called an overbroad definition of ""terrorists"" that could include non-terrorism suspects.",0.8885132074356079
51,"But civil liberties advocates, who have pushed for the repeal of secret intelligence warrants under the library records provision, argue that federal authorities can already use standard criminal warrants at libraries if they have evidence linking a suspect to terrorism.","President George W. Bush on Monday urged Congress to reauthorize the USA Patriot Act, the Justice Department's widely criticized anti-terrorism law.",0.8882431983947754
14,"An amendment to the 2005 defense authorization bill currently before Congress could immediately halt the development of offshore wind-power facilities in the United States, including a controversial project planned for coastal Massachusetts, environmental groups and developers said this week.","Cape Wind's involvement in the report has drawn critics, including Nickerson, who says the Army Corps was overly reliant on data collected by consultants paid for by the developer.",0.8878257274627686
91,"At least as intriguing as the nature of the moon's surface is the precise composition of Titan's smoggy, 12-layered atmosphere, which many believe may closely resemble the mix of gases that early Earth possessed -- rich in the organic chemicals essential for life to emerge and evolve.","With a gentle shove on Christmas Eve, the Cassini spacecraft will launch the European Space Agency's Huygens probe on a course that should send it plunging into the atmosphere of Saturn's big moon Titan.",0.8838562369346619
73,"Paul Smith, vice president of the California Grocers Association, said the proposal is strongly opposed by the industry group.","Rwanda imposed a ban on the manufacture and importation of  polythene bags last year, while the United Nations Environment  Program is working with the Kenyan government to ban plastic bags  there in a new waste management strategy.",0.8823844790458679
52,"President George W. Bush on Monday urged Congress to reauthorize the USA Patriot Act, the Justice Department's widely criticized anti-terrorism law.","Critics says among the law's more controversial powers is the FBI's ability to obtain library and bookstore records in terrorism cases, and so-called ""sneak and peek"" search warrants in which agents need not immediately tell suspects their home or business had been searched.",0.8780874609947205
66,"More than 7,000  Hurricane Katrina survivors taking refuge in Texas shelters were  being uprooted again Tuesday as Hurricane Rita threatened the state  neighboring Louisiana, officials said.","Hurricane Rita barreled near southern Florida islands and headed  toward the Gulf of Mexico, threatening Texas and Louisiana with  winds of 160 kilometers per hour (100 mph).",0.8769171237945557
10,Yet these dire developments have been a boon for companies that make devices like silicon wafers and rooftop panels that convert solar energy.,"And the new federal energy law, signed by President Bush last month, includes a tax credit of as much as $2,000 for the purchase and installation of a residential solar-power system.",0.8750596046447754
68,"For 2005, it budgeted nearly $3 billion for research and development of climate-change technology, mostly through subsidies and tax breaks for work on hydrogen fuel-cell developments and so-called clean coal technology, which releases less carbon dioxide.","Carbon dioxode and methane are among what are known as  greenhouse gases, increased concentrations of which in the earth's  atmosphere have been blamed by scientists for global warming.",0.8711509108543396
74,"Paul Smith, vice president of the California Grocers Association, said the proposal is strongly opposed by the industry group.","The San Francisco proposal parallels efforts in Ireland, South Africa, Bangladesh, Australia, Shanghai and Taiwan, which ban plastic bags or charge a fee to use them.",0.8685739040374756
17,"Downtown Los Angeles has had more than 15 inches of rain since Jan. 1, more than its average rainfall for an entire year, including 2.6 inches on Sunday, a record, the National Weather Service said.","Union Pacific's troubles included 23 mudslides that covered tracks in the Cajon Pass east of Los Angeles, a key passageway from Southern California to Las Vegas and Salt Lake City, and eventually to the Midwest.",0.8674450516700745
87,"Hong Kong Disneyland will stage  its rehearsal from Aug. 16 to the theme park's opening on Sept.  12, the park said in a press release on Friday.","Specially invited guests including business affiliates, travel  trade associates, contractors, consultants, alliance partners,  government officers who have been involved in the Hong Kong  Disneyland project, and certain charitable organizations can enjoy a full day of Disney magic.",0.8654569387435913
18,"Los Angeles will get a much-needed break early Monday from the unforgiving rain that has pounded Southern California since Thursday, but a new front will move in Monday night, bringing with it an additional 2 inches to 4 inches of rain.","Union Pacific's troubles included 23 mudslides that covered tracks in the Cajon Pass east of Los Angeles, a key passageway from Southern California to Las Vegas and Salt Lake City, and eventually to the Midwest.",0.8599284887313843
45,"The cardinals drew lots last week for rooms in the $20 million ""Domus Sanctae Marthae"" (St. Martha's House), a hotel built by John Paul II and operated by the Daughters of Charity of St. Vincent DePaul.","Other presumed front-runners include a slew of Italian cardinals, including Dionigi Tettamanzi, Angelo Sodano and Carlo Martini; Latin Americans Jorge Mario Bergoglio of Argentina, Oscar Rodriguez Maradiaga of Honduras and Claudio Hummes of Brazil; a Nigerian, Francis Arinze; and an Indian, Ivan Dias.",0.8595215082168579
15,"Downtown Los Angeles has had more than 15 inches of rain since Jan. 1, more than its average rainfall for an entire year, including 2.6 inches on Sunday, a record, the National Weather Service said.","Los Angeles County fire rescue workers recovered the man's body about 500 feet from where the vehicle went into the water off Tuna Canyon Beach, said Lt.",0.8559476137161255
